{
  "sourceTitle": "HTML Noise Filtering",
  "format": "html",
  "structureKind": "anchor_graph",
  "navigationOrder": [
    "html-main",
    "html-main-noise"
  ],
  "blocks": [
    {
      "id": "html-main",
      "type": "paragraph",
      "title": "HTML Noise Filtering",
      "textSummary": "Traceable lesson content.",
      "sourceTrace": {
        "id": "st-html-main",
        "source_format": "html",
        "locator": "source.html",
        "blockId": "html-main",
        "boundaryConfidence": "explicit",
        "evidenceType": "source-derived",
        "anchor": "main",
        "headingPath": [
          "Main concept"
        ],
        "granularity": "paragraph"
      }
    },
    {
      "id": "html-main-noise",
      "type": "navigation",
      "title": "Noise metadata",
      "textSummary": "Filtered source noise.",
      "sourceTrace": {
        "id": "st-html-main-noise",
        "source_format": "html",
        "locator": "source.html",
        "blockId": "html-main-noise",
        "boundaryConfidence": "explicit",
        "evidenceType": "source-derived",
        "granularity": "outline"
      }
    }
  ],
  "sourceTraces": [
    {
      "id": "st-html-main",
      "source_format": "html",
      "locator": "source.html",
      "blockId": "html-main",
      "boundaryConfidence": "explicit",
      "evidenceType": "source-derived",
      "anchor": "main",
      "headingPath": [
        "Main concept"
      ],
      "granularity": "paragraph"
    },
    {
      "id": "st-html-main-noise",
      "source_format": "html",
      "locator": "source.html",
      "blockId": "html-main-noise",
      "boundaryConfidence": "explicit",
      "evidenceType": "source-derived",
      "granularity": "outline"
    }
  ],
  "uncertaintyNotes": []
}
